{
  "id": "fetch_2026_07_10_static_cninfo_com_cn_972787e9ea",
  "fetcher": "ingestion_entry_v1",
  "sourceName": "大唐发电",
  "sourceType": "ingestion",
  "startedAt": "2026-07-23T09:50:52+08:00",
  "finishedAt": "2026-07-23T09:50:52+08:00",
  "status": "partial",
  "artifactIds": [
    "raw_2026_07_10_static_cninfo_com_cn_972787e9ea"
  ],
  "claimIds": [
    "claim_2026_07_10_filing_4b1dc2a60c"
  ],
  "error": null,
  "gaps": [
    {
      "kind": "raw_payload_not_fetched",
      "description": "Ingestion captured source metadata only; raw body retrieval is not enabled for this source yet.",
      "severity": "medium"
    }
  ],
  "attemptLedger": [
    {
      "kind": "source_capture",
      "inputType": "url",
      "url": "http://static.cninfo.com.cn/finalpage/2026-07-10/1225417885.PDF",
      "status": "metadata_only",
      "startedAt": "2026-07-23T09:50:52+08:00",
      "finishedAt": "2026-07-23T09:50:52+08:00",
      "contentHash": "sha256:a1edf45062ed5472f1ca1156da996ef6f7250d892e88806e0c8f8145a4a85419",
      "storagePath": "raw_artifacts/payloads/raw_2026_07_10_static_cninfo_com_cn_972787e9ea.json"
    }
  ]
}
