{
  "id": "fetch_2026_06_19_static_cninfo_com_cn_e90b9a2d00",
  "fetcher": "ingestion_entry_v1",
  "sourceName": "沪硅产业",
  "sourceType": "ingestion",
  "startedAt": "2026-07-23T09:31:19+08:00",
  "finishedAt": "2026-07-23T09:31:19+08:00",
  "status": "partial",
  "artifactIds": [
    "raw_2026_06_19_static_cninfo_com_cn_e90b9a2d00"
  ],
  "claimIds": [
    "claim_2026_06_19_filing_94f9ece4f4"
  ],
  "error": null,
  "gaps": [
    {
      "kind": "raw_payload_not_fetched",
      "description": "Ingestion captured source metadata only; raw body retrieval is not enabled for this source yet.",
      "severity": "medium"
    }
  ],
  "attemptLedger": [
    {
      "kind": "source_capture",
      "inputType": "url",
      "url": "http://static.cninfo.com.cn/finalpage/2026-06-19/1225379556.PDF",
      "status": "metadata_only",
      "startedAt": "2026-07-23T09:31:19+08:00",
      "finishedAt": "2026-07-23T09:31:19+08:00",
      "contentHash": "sha256:37803d6c5019557db7ed3edca396fa984cf98367aa1e09290e22a08eea2fd872",
      "storagePath": "raw_artifacts/payloads/raw_2026_06_19_static_cninfo_com_cn_e90b9a2d00.json"
    }
  ]
}
