{
  "id": "fetch_2025_08_30_static_cninfo_com_cn_5120c764a7",
  "fetcher": "ingestion_entry_v1",
  "sourceName": "概伦电子",
  "sourceType": "ingestion",
  "startedAt": "2026-07-23T09:56:01+08:00",
  "finishedAt": "2026-07-23T09:57:41+08:00",
  "status": "success",
  "artifactIds": [
    "raw_2025_08_30_static_cninfo_com_cn_5120c764a7"
  ],
  "claimIds": [
    "claim_2025_08_30_filing_ee9788fd02"
  ],
  "error": null,
  "gaps": [],
  "attemptLedger": [
    {
      "kind": "source_capture",
      "inputType": "url",
      "url": "http://static.cninfo.com.cn/finalpage/2025-08-30/1224620470.PDF",
      "status": "metadata_only",
      "startedAt": "2026-07-23T09:56:01+08:00",
      "finishedAt": "2026-07-23T09:56:01+08:00",
      "contentHash": "sha256:57b8a745a986c493bca3e26736b3d21d6b0c9e6482943f9464f255fbad4a5092",
      "storagePath": "raw_artifacts/payloads/raw_2025_08_30_static_cninfo_com_cn_5120c764a7.json"
    },
    {
      "kind": "material_body_fetch",
      "status": "success",
      "startedAt": "2026-07-23T09:57:41+08:00",
      "finishedAt": "2026-07-23T09:57:41+08:00",
      "contentHash": "sha256:8ff32f54782bfbd0654e1562898de2adbd25625ee4fdece601550f9f53b02ac3",
      "storagePath": "raw_artifacts/payloads/raw_2025_08_30_static_cninfo_com_cn_5120c764a7.json"
    }
  ]
}
