{
  "id": "fetch_2026_06_04_static_cninfo_com_cn_53468d76be",
  "fetcher": "ingestion_entry_v1",
  "sourceName": "中微公司",
  "sourceType": "ingestion",
  "startedAt": "2026-07-23T09:50:52+08:00",
  "finishedAt": "2026-07-23T09:50:52+08:00",
  "status": "partial",
  "artifactIds": [
    "raw_2026_06_04_static_cninfo_com_cn_53468d76be"
  ],
  "claimIds": [
    "claim_2026_06_04_filing_1ed5f6b0f8"
  ],
  "error": null,
  "gaps": [
    {
      "kind": "raw_payload_not_fetched",
      "description": "Ingestion captured source metadata only; raw body retrieval is not enabled for this source yet.",
      "severity": "medium"
    }
  ],
  "attemptLedger": [
    {
      "kind": "source_capture",
      "inputType": "url",
      "url": "http://static.cninfo.com.cn/finalpage/2026-06-04/1225349142.PDF",
      "status": "metadata_only",
      "startedAt": "2026-07-23T09:50:52+08:00",
      "finishedAt": "2026-07-23T09:50:52+08:00",
      "contentHash": "sha256:2c410b8cd7d7c1f92c345c9634445acd358b73d16839c01affce0e220613929d",
      "storagePath": "raw_artifacts/payloads/raw_2026_06_04_static_cninfo_com_cn_53468d76be.json"
    }
  ]
}
