{
  "id": "fetch_2026_05_30_static_cninfo_com_cn_bdffe46d35",
  "fetcher": "ingestion_entry_v1",
  "sourceName": "大唐发电",
  "sourceType": "ingestion",
  "startedAt": "2026-07-23T09:50:52+08:00",
  "finishedAt": "2026-07-23T09:50:52+08:00",
  "status": "partial",
  "artifactIds": [
    "raw_2026_05_30_static_cninfo_com_cn_bdffe46d35"
  ],
  "claimIds": [
    "claim_2026_05_30_filing_1a11e0e2bb"
  ],
  "error": null,
  "gaps": [
    {
      "kind": "raw_payload_not_fetched",
      "description": "Ingestion captured source metadata only; raw body retrieval is not enabled for this source yet.",
      "severity": "medium"
    }
  ],
  "attemptLedger": [
    {
      "kind": "source_capture",
      "inputType": "url",
      "url": "http://static.cninfo.com.cn/finalpage/2026-05-30/1225339564.PDF",
      "status": "metadata_only",
      "startedAt": "2026-07-23T09:50:52+08:00",
      "finishedAt": "2026-07-23T09:50:52+08:00",
      "contentHash": "sha256:66b3ae57e2644a1e967331436ead9b57dc2f0a15e8c815f411f087c960d1e384",
      "storagePath": "raw_artifacts/payloads/raw_2026_05_30_static_cninfo_com_cn_bdffe46d35.json"
    }
  ]
}
