{
  "id": "fetch_2026_07_29_static_cninfo_com_cn_603101b334",
  "fetcher": "ingestion_entry_v1",
  "sourceName": "寒武纪",
  "sourceType": "ingestion",
  "startedAt": "2026-07-29T16:16:17+08:00",
  "finishedAt": "2026-07-29T16:16:17+08:00",
  "status": "partial",
  "artifactIds": [
    "raw_2026_07_29_static_cninfo_com_cn_603101b334"
  ],
  "claimIds": [
    "claim_2026_07_29_filing_ce08d61279"
  ],
  "error": null,
  "gaps": [
    {
      "kind": "raw_payload_not_fetched",
      "description": "Ingestion captured source metadata only; raw body retrieval is not enabled for this source yet.",
      "severity": "medium"
    }
  ],
  "attemptLedger": [
    {
      "kind": "source_capture",
      "inputType": "url",
      "url": "http://static.cninfo.com.cn/finalpage/2026-07-29/1225445751.PDF",
      "status": "metadata_only",
      "startedAt": "2026-07-29T16:16:17+08:00",
      "finishedAt": "2026-07-29T16:16:17+08:00",
      "contentHash": "sha256:fc87c20fe899cb7d452c68aebbf6d13b79686fc2b849718262874c7deb47c82e",
      "storagePath": "raw_artifacts/payloads/raw_2026_07_29_static_cninfo_com_cn_603101b334.json"
    }
  ]
}
