{
  "id": "fetch_2026_07_01_static_cninfo_com_cn_7ab4bb0d49",
  "fetcher": "ingestion_entry_v1",
  "sourceName": "寒武纪",
  "sourceType": "ingestion",
  "startedAt": "2026-07-22T16:15:52+08:00",
  "finishedAt": "2026-07-23T09:32:46+08:00",
  "status": "success",
  "artifactIds": [
    "raw_2026_07_01_static_cninfo_com_cn_7ab4bb0d49"
  ],
  "claimIds": [
    "claim_2026_07_01_filing_09ae5b8287"
  ],
  "error": null,
  "gaps": [],
  "attemptLedger": [
    {
      "kind": "source_capture",
      "inputType": "url",
      "url": "http://static.cninfo.com.cn/finalpage/2026-07-01/1225401954.PDF",
      "status": "metadata_only",
      "startedAt": "2026-07-22T16:15:52+08:00",
      "finishedAt": "2026-07-22T16:15:52+08:00",
      "contentHash": "sha256:5824e1a3bab1fedff8560c6adb6f34f94ac21e7827873f2e4c3efcb96cc63e2f",
      "storagePath": "raw_artifacts/payloads/raw_2026_07_01_static_cninfo_com_cn_7ab4bb0d49.json"
    },
    {
      "kind": "material_body_fetch",
      "status": "success",
      "startedAt": "2026-07-23T09:32:46+08:00",
      "finishedAt": "2026-07-23T09:32:46+08:00",
      "contentHash": "sha256:4e640f562aa8061b0142d2c8944512f97dd942697c361a50d0daab62c8021c26",
      "storagePath": "raw_artifacts/payloads/raw_2026_07_01_static_cninfo_com_cn_7ab4bb0d49.json"
    }
  ]
}
