{
  "id": "fetch_2026_04_29_static_cninfo_com_cn_5ca9af99b1",
  "fetcher": "ingestion_entry_v1",
  "sourceName": "国际实业",
  "sourceType": "ingestion",
  "startedAt": "2026-07-23T09:50:52+08:00",
  "finishedAt": "2026-07-23T09:53:42+08:00",
  "status": "success",
  "artifactIds": [
    "raw_2026_04_29_static_cninfo_com_cn_5ca9af99b1"
  ],
  "claimIds": [
    "claim_2026_04_29_filing_04fecfe8c1"
  ],
  "error": null,
  "gaps": [],
  "attemptLedger": [
    {
      "kind": "source_capture",
      "inputType": "url",
      "url": "http://static.cninfo.com.cn/finalpage/2026-04-29/1225226164.PDF",
      "status": "metadata_only",
      "startedAt": "2026-07-23T09:50:52+08:00",
      "finishedAt": "2026-07-23T09:50:52+08:00",
      "contentHash": "sha256:d62b38dea6f90c1076ac0f4ba73aba77e70f6ea5757ae6fe9e9e2a245576afe4",
      "storagePath": "raw_artifacts/payloads/raw_2026_04_29_static_cninfo_com_cn_5ca9af99b1.json"
    },
    {
      "kind": "material_body_fetch",
      "status": "success",
      "startedAt": "2026-07-23T09:53:42+08:00",
      "finishedAt": "2026-07-23T09:53:42+08:00",
      "contentHash": "sha256:81d4e9f77686812977db9b96e559baa891d84e74d231a103467a410d9fcc82bc",
      "storagePath": "raw_artifacts/payloads/raw_2026_04_29_static_cninfo_com_cn_5ca9af99b1.json"
    }
  ]
}
