{
  "id": "fetch_2026_07_16_static_cninfo_com_cn_0cc80bf8c8",
  "fetcher": "ingestion_entry_v1",
  "sourceName": "中大力德",
  "sourceType": "ingestion",
  "startedAt": "2026-07-16T16:15:41+08:00",
  "finishedAt": "2026-07-16T16:15:41+08:00",
  "status": "partial",
  "artifactIds": [
    "raw_2026_07_16_static_cninfo_com_cn_0cc80bf8c8"
  ],
  "claimIds": [
    "claim_2026_07_16_filing_29d2def063"
  ],
  "error": null,
  "gaps": [
    {
      "kind": "raw_payload_not_fetched",
      "description": "Ingestion captured source metadata only; raw body retrieval is not enabled for this source yet.",
      "severity": "medium"
    }
  ],
  "attemptLedger": [
    {
      "kind": "source_capture",
      "inputType": "url",
      "url": "http://static.cninfo.com.cn/finalpage/2026-07-16/1225426941.PDF",
      "status": "metadata_only",
      "startedAt": "2026-07-16T16:15:41+08:00",
      "finishedAt": "2026-07-16T16:15:41+08:00",
      "contentHash": "sha256:d16836cd31a2ec4382d8d8027e6fa272932c2d4a8a40bb906a8e040c808da2ef",
      "storagePath": "raw_artifacts/payloads/raw_2026_07_16_static_cninfo_com_cn_0cc80bf8c8.json"
    }
  ]
}
