{
  "id": "fetch_2026_07_14_static_cninfo_com_cn_86b77cdb02",
  "fetcher": "ingestion_entry_v1",
  "sourceName": "安集科技",
  "sourceType": "ingestion",
  "startedAt": "2026-07-23T09:50:52+08:00",
  "finishedAt": "2026-07-23T09:50:52+08:00",
  "status": "partial",
  "artifactIds": [
    "raw_2026_07_14_static_cninfo_com_cn_86b77cdb02"
  ],
  "claimIds": [
    "claim_2026_07_14_filing_fa20b5a69d"
  ],
  "error": null,
  "gaps": [
    {
      "kind": "raw_payload_not_fetched",
      "description": "Ingestion captured source metadata only; raw body retrieval is not enabled for this source yet.",
      "severity": "medium"
    }
  ],
  "attemptLedger": [
    {
      "kind": "source_capture",
      "inputType": "url",
      "url": "http://static.cninfo.com.cn/finalpage/2026-07-14/1225422188.PDF",
      "status": "metadata_only",
      "startedAt": "2026-07-23T09:50:52+08:00",
      "finishedAt": "2026-07-23T09:50:52+08:00",
      "contentHash": "sha256:49052ab0cb62b293eba8eb0cc666d0201d541ddc5a4856337e60476d93be4ea1",
      "storagePath": "raw_artifacts/payloads/raw_2026_07_14_static_cninfo_com_cn_86b77cdb02.json"
    }
  ]
}
