{
  "id": "fetch_2026_05_16_static_cninfo_com_cn_6424dec382",
  "fetcher": "ingestion_entry_v1",
  "sourceName": "国际实业",
  "sourceType": "ingestion",
  "startedAt": "2026-07-23T09:50:52+08:00",
  "finishedAt": "2026-07-23T09:50:52+08:00",
  "status": "partial",
  "artifactIds": [
    "raw_2026_05_16_static_cninfo_com_cn_6424dec382"
  ],
  "claimIds": [
    "claim_2026_05_16_filing_08ce052657"
  ],
  "error": null,
  "gaps": [
    {
      "kind": "raw_payload_not_fetched",
      "description": "Ingestion captured source metadata only; raw body retrieval is not enabled for this source yet.",
      "severity": "medium"
    }
  ],
  "attemptLedger": [
    {
      "kind": "source_capture",
      "inputType": "url",
      "url": "http://static.cninfo.com.cn/finalpage/2026-05-16/1225308636.PDF",
      "status": "metadata_only",
      "startedAt": "2026-07-23T09:50:52+08:00",
      "finishedAt": "2026-07-23T09:50:52+08:00",
      "contentHash": "sha256:dd6cd92558d16b3b686648dc49d4e5901b97901e93439c50916967619f913818",
      "storagePath": "raw_artifacts/payloads/raw_2026_05_16_static_cninfo_com_cn_6424dec382.json"
    }
  ]
}
