{
  "id": "fetch_2023_06_07_unitree_com_58166e9fc2",
  "fetcher": "ingestion_entry_v1",
  "sourceName": "宇树科技股份有限公司",
  "sourceType": "ingestion",
  "startedAt": "2026-07-15T10:58:14+08:00",
  "finishedAt": "2026-07-15T10:58:14+08:00",
  "status": "partial",
  "artifactIds": [
    "raw_2023_06_07_unitree_com_58166e9fc2"
  ],
  "claimIds": [
    "claim_2023_06_07_other_c1337847c9"
  ],
  "error": null,
  "gaps": [
    {
      "kind": "raw_payload_not_fetched",
      "description": "Ingestion captured source metadata only; raw body retrieval is not enabled for this source yet.",
      "severity": "medium"
    }
  ],
  "attemptLedger": [
    {
      "kind": "source_capture",
      "inputType": "url",
      "url": "https://www.unitree.com/cn/news/17",
      "status": "metadata_only",
      "startedAt": "2026-07-15T10:58:14+08:00",
      "finishedAt": "2026-07-15T10:58:14+08:00",
      "contentHash": "sha256:78f86cc717da06fddb5ea9eb94afed63e664e70b5c52d75d39e66130228f6feb",
      "storagePath": "raw_artifacts/payloads/raw_2023_06_07_unitree_com_58166e9fc2.json"
    }
  ]
}
