{
  "id": "fetch_2026_04_30_static_cninfo_com_cn_f0c373e20a",
  "fetcher": "ingestion_entry_v1",
  "sourceName": "通富微电",
  "sourceType": "ingestion",
  "startedAt": "2026-07-23T09:50:52+08:00",
  "finishedAt": "2026-07-23T09:50:52+08:00",
  "status": "partial",
  "artifactIds": [
    "raw_2026_04_30_static_cninfo_com_cn_f0c373e20a"
  ],
  "claimIds": [
    "claim_2026_04_30_filing_39ff1e28c4"
  ],
  "error": null,
  "gaps": [
    {
      "kind": "raw_payload_not_fetched",
      "description": "Ingestion captured source metadata only; raw body retrieval is not enabled for this source yet.",
      "severity": "medium"
    }
  ],
  "attemptLedger": [
    {
      "kind": "source_capture",
      "inputType": "url",
      "url": "http://static.cninfo.com.cn/finalpage/2026-04-30/1225261886.PDF",
      "status": "metadata_only",
      "startedAt": "2026-07-23T09:50:52+08:00",
      "finishedAt": "2026-07-23T09:50:52+08:00",
      "contentHash": "sha256:e80847086126165ba4dd2f92e68e3949f05698d566ca6a1c6e35d1c31215e631",
      "storagePath": "raw_artifacts/payloads/raw_2026_04_30_static_cninfo_com_cn_f0c373e20a.json"
    }
  ]
}
