{
  "id": "fetch_2026_07_03_static_cninfo_com_cn_760cac20ec",
  "fetcher": "ingestion_entry_v1",
  "sourceName": "恒瑞医药",
  "sourceType": "ingestion",
  "startedAt": "2026-07-23T09:50:52+08:00",
  "finishedAt": "2026-07-23T09:50:52+08:00",
  "status": "partial",
  "artifactIds": [
    "raw_2026_07_03_static_cninfo_com_cn_760cac20ec"
  ],
  "claimIds": [
    "claim_2026_07_03_filing_fe9f5badf7"
  ],
  "error": null,
  "gaps": [
    {
      "kind": "raw_payload_not_fetched",
      "description": "Ingestion captured source metadata only; raw body retrieval is not enabled for this source yet.",
      "severity": "medium"
    }
  ],
  "attemptLedger": [
    {
      "kind": "source_capture",
      "inputType": "url",
      "url": "http://static.cninfo.com.cn/finalpage/2026-07-03/1225405395.PDF",
      "status": "metadata_only",
      "startedAt": "2026-07-23T09:50:52+08:00",
      "finishedAt": "2026-07-23T09:50:52+08:00",
      "contentHash": "sha256:b94aad8f5b77b51c3695ff70c8a714a221700a4e1c678c06de7957f52e2890ba",
      "storagePath": "raw_artifacts/payloads/raw_2026_07_03_static_cninfo_com_cn_760cac20ec.json"
    }
  ]
}
