{
  "id": "fetch_2026_08_21_static_cninfo_com_cn_e7cc305b1a",
  "fetcher": "ingestion_entry_v1",
  "sourceName": "长电科技",
  "sourceType": "ingestion",
  "startedAt": "2026-08-22T16:15:52+08:00",
  "finishedAt": "2026-08-22T16:15:52+08:00",
  "status": "partial",
  "artifactIds": [
    "raw_2026_08_21_static_cninfo_com_cn_e7cc305b1a"
  ],
  "claimIds": [
    "claim_2026_08_21_filing_4e23e4208c"
  ],
  "error": null,
  "gaps": [
    {
      "kind": "raw_payload_not_fetched",
      "description": "Ingestion captured source metadata only; raw body retrieval is not enabled for this source yet.",
      "severity": "medium"
    }
  ],
  "attemptLedger": [
    {
      "kind": "source_capture",
      "inputType": "url",
      "url": "http://static.cninfo.com.cn/finalpage/2026-08-21/1225487903.PDF",
      "status": "metadata_only",
      "startedAt": "2026-08-22T16:15:52+08:00",
      "finishedAt": "2026-08-22T16:15:52+08:00",
      "contentHash": "sha256:1a49fe71d817b361a0996d15c943803cca1b9b979806e186b25ce0f9d3ebe54a",
      "storagePath": "raw_artifacts/payloads/raw_2026_08_21_static_cninfo_com_cn_e7cc305b1a.json"
    }
  ]
}
