{
  "id": "fetch_2026_03_27_static_cninfo_com_cn_21d1d400ee",
  "fetcher": "ingestion_entry_v1",
  "sourceName": "中国海油",
  "sourceType": "ingestion",
  "startedAt": "2026-07-23T09:50:52+08:00",
  "finishedAt": "2026-07-23T09:50:52+08:00",
  "status": "partial",
  "artifactIds": [
    "raw_2026_03_27_static_cninfo_com_cn_21d1d400ee"
  ],
  "claimIds": [
    "claim_2026_03_27_filing_65e0d11eb8"
  ],
  "error": null,
  "gaps": [
    {
      "kind": "raw_payload_not_fetched",
      "description": "Ingestion captured source metadata only; raw body retrieval is not enabled for this source yet.",
      "severity": "medium"
    }
  ],
  "attemptLedger": [
    {
      "kind": "source_capture",
      "inputType": "url",
      "url": "http://static.cninfo.com.cn/finalpage/2026-03-27/1225036046.PDF",
      "status": "metadata_only",
      "startedAt": "2026-07-23T09:50:52+08:00",
      "finishedAt": "2026-07-23T09:50:52+08:00",
      "contentHash": "sha256:d69553b3da08f0d2f4497008c5be7934f76fd5a197f2c4ead527a38103c85f77",
      "storagePath": "raw_artifacts/payloads/raw_2026_03_27_static_cninfo_com_cn_21d1d400ee.json"
    }
  ]
}
