{
  "id": "fetch_2026_07_03_static_cninfo_com_cn_c0d166e13f",
  "fetcher": "ingestion_entry_v1",
  "sourceName": "恒瑞医药",
  "sourceType": "ingestion",
  "startedAt": "2026-07-23T09:50:52+08:00",
  "finishedAt": "2026-07-23T09:50:52+08:00",
  "status": "partial",
  "artifactIds": [
    "raw_2026_07_03_static_cninfo_com_cn_c0d166e13f"
  ],
  "claimIds": [
    "claim_2026_07_03_filing_ccd1fd9ef5"
  ],
  "error": null,
  "gaps": [
    {
      "kind": "raw_payload_not_fetched",
      "description": "Ingestion captured source metadata only; raw body retrieval is not enabled for this source yet.",
      "severity": "medium"
    }
  ],
  "attemptLedger": [
    {
      "kind": "source_capture",
      "inputType": "url",
      "url": "http://static.cninfo.com.cn/finalpage/2026-07-03/1225405465.PDF",
      "status": "metadata_only",
      "startedAt": "2026-07-23T09:50:52+08:00",
      "finishedAt": "2026-07-23T09:50:52+08:00",
      "contentHash": "sha256:34257acaf91fe490c594f5dc6cda05301defd8ca848a0efc797bed1940814504",
      "storagePath": "raw_artifacts/payloads/raw_2026_07_03_static_cninfo_com_cn_c0d166e13f.json"
    }
  ]
}
