{
  "id": "fetch_2025_04_16_static_cninfo_com_cn_79d5219cba",
  "fetcher": "ingestion_entry_v1",
  "sourceName": "安集科技",
  "sourceType": "ingestion",
  "startedAt": "2026-07-23T09:56:01+08:00",
  "finishedAt": "2026-07-23T16:16:36+08:00",
  "status": "success",
  "artifactIds": [
    "raw_2025_04_16_static_cninfo_com_cn_79d5219cba"
  ],
  "claimIds": [
    "claim_2025_04_16_filing_1dafcda4fd"
  ],
  "error": null,
  "gaps": [],
  "attemptLedger": [
    {
      "kind": "source_capture",
      "inputType": "url",
      "url": "http://static.cninfo.com.cn/finalpage/2025-04-16/1223101942.PDF",
      "status": "metadata_only",
      "startedAt": "2026-07-23T09:56:01+08:00",
      "finishedAt": "2026-07-23T09:56:01+08:00",
      "contentHash": "sha256:3cdb89f78c6e99140e3464d707ad524f4827aeebcdc88977ffe2c1d4128ec4af",
      "storagePath": "raw_artifacts/payloads/raw_2025_04_16_static_cninfo_com_cn_79d5219cba.json"
    },
    {
      "kind": "material_body_fetch",
      "status": "success",
      "startedAt": "2026-07-23T16:16:36+08:00",
      "finishedAt": "2026-07-23T16:16:36+08:00",
      "contentHash": "sha256:b42f178c5c31b34f897a16d976779a4c22a1d2dd2eb2e8ecb65643623340c953",
      "storagePath": "raw_artifacts/payloads/raw_2025_04_16_static_cninfo_com_cn_79d5219cba.json"
    }
  ]
}
