{
  "id": "fetch_2026_07_01_static_cninfo_com_cn_725be402fd",
  "fetcher": "ingestion_entry_v1",
  "sourceName": "兴业银锡",
  "sourceType": "ingestion",
  "startedAt": "2026-07-23T09:50:52+08:00",
  "finishedAt": "2026-07-23T09:50:52+08:00",
  "status": "partial",
  "artifactIds": [
    "raw_2026_07_01_static_cninfo_com_cn_725be402fd"
  ],
  "claimIds": [
    "claim_2026_07_01_filing_47227d9c64"
  ],
  "error": null,
  "gaps": [
    {
      "kind": "raw_payload_not_fetched",
      "description": "Ingestion captured source metadata only; raw body retrieval is not enabled for this source yet.",
      "severity": "medium"
    }
  ],
  "attemptLedger": [
    {
      "kind": "source_capture",
      "inputType": "url",
      "url": "http://static.cninfo.com.cn/finalpage/2026-07-01/1225401212.PDF",
      "status": "metadata_only",
      "startedAt": "2026-07-23T09:50:52+08:00",
      "finishedAt": "2026-07-23T09:50:52+08:00",
      "contentHash": "sha256:20bca54f64ead5a1c95a20b3875e7660029f6f9a73d05f2a9d66efffe3b6c75b",
      "storagePath": "raw_artifacts/payloads/raw_2026_07_01_static_cninfo_com_cn_725be402fd.json"
    }
  ]
}
