{
  "id": "fetch_2026_08_04_static_cninfo_com_cn_18eadf889d",
  "fetcher": "ingestion_entry_v1",
  "sourceName": "概伦电子",
  "sourceType": "ingestion",
  "startedAt": "2026-08-04T16:16:54+08:00",
  "finishedAt": "2026-08-04T16:16:54+08:00",
  "status": "partial",
  "artifactIds": [
    "raw_2026_08_04_static_cninfo_com_cn_18eadf889d"
  ],
  "claimIds": [
    "claim_2026_08_04_filing_4ec7944388"
  ],
  "error": null,
  "gaps": [
    {
      "kind": "raw_payload_not_fetched",
      "description": "Ingestion captured source metadata only; raw body retrieval is not enabled for this source yet.",
      "severity": "medium"
    }
  ],
  "attemptLedger": [
    {
      "kind": "source_capture",
      "inputType": "url",
      "url": "http://static.cninfo.com.cn/finalpage/2026-08-04/1225455594.PDF",
      "status": "metadata_only",
      "startedAt": "2026-08-04T16:16:54+08:00",
      "finishedAt": "2026-08-04T16:16:54+08:00",
      "contentHash": "sha256:78a7a0b8950c1f5486070fd150fed8c4d8708bd4a8167bf251287cf07a8eca52",
      "storagePath": "raw_artifacts/payloads/raw_2026_08_04_static_cninfo_com_cn_18eadf889d.json"
    }
  ]
}
