{
  "id": "fetch_2023_09_01_ubtrobot_com_6b74e3e827",
  "fetcher": "ingestion_entry_v1",
  "sourceName": "UBTECH ROBOTICS CORP LTD",
  "sourceType": "ingestion",
  "startedAt": "2026-07-15T10:58:14+08:00",
  "finishedAt": "2026-07-15T10:58:14+08:00",
  "status": "partial",
  "artifactIds": [
    "raw_2023_09_01_ubtrobot_com_6b74e3e827"
  ],
  "claimIds": [
    "claim_2023_09_01_other_46cb0fde41"
  ],
  "error": null,
  "gaps": [
    {
      "kind": "raw_payload_not_fetched",
      "description": "Ingestion captured source metadata only; raw body retrieval is not enabled for this source yet.",
      "severity": "medium"
    }
  ],
  "attemptLedger": [
    {
      "kind": "source_capture",
      "inputType": "url",
      "url": "https://www.ubtrobot.com/en/about/news/473378826465349",
      "status": "metadata_only",
      "startedAt": "2026-07-15T10:58:14+08:00",
      "finishedAt": "2026-07-15T10:58:14+08:00",
      "contentHash": "sha256:a356eb6ff3920a8e578c698ead6d0d1a8cf0ce9935b291a343c42ae26945832e",
      "storagePath": "raw_artifacts/payloads/raw_2023_09_01_ubtrobot_com_6b74e3e827.json"
    }
  ]
}
